{
  "source_file": "de_thi_toan_12_hk1_2024.docx",
  "extraction_date": "2026-04-07T11:00:00+07:00",
  "total_questions": 5,
  "summary": {
    "multiple_choice": 3,
    "essay": 2,
    "with_images": 1,
    "topics": ["Nguyên hàm - Tích phân", "Hình học không gian", "Số phức"]
  },
  "questions": [
    {
      "id": "Q001",
      "type": "multiple_choice",
      "content": "Tìm nguyên hàm của hàm số $f(x) = 2x + 3$.",
      "options": {
        "A": "$x^2 + 3x + C$",
        "B": "$x^2 + 3 + C$",
        "C": "$2x^2 + 3x + C$",
        "D": "$x^2 + 3x$"
      },
      "correct_answer": "A",
      "solution": "Ta có:\n$$\\int (2x + 3)\\,dx = \\frac{2x^2}{2} + 3x + C = x^2 + 3x + C$$",
      "images": [],
      "metadata": {
        "subject": "Toán học",
        "grade": "12",
        "topic": "Nguyên hàm - Tích phân",
        "subtopic": "Nguyên hàm cơ bản",
        "difficulty": "Nhận biết",
        "bloom_level": 1,
        "tags": ["nguyên hàm", "đa thức"],
        "points": 0.25
      }
    },
    {
      "id": "Q002",
      "type": "multiple_choice",
      "content": "Tính tích phân $I = \\int_0^1 \\frac{x}{x^2+1}\\,dx$.",
      "options": {
        "A": "$\\frac{1}{2}\\ln 2$",
        "B": "$\\ln 2$",
        "C": "$\\frac{\\ln 2}{4}$",
        "D": "$2\\ln 2$"
      },
      "correct_answer": "A",
      "solution": "Đặt $t = x^2 + 1 \\Rightarrow dt = 2x\\,dx$.\n\nĐổi cận: $x=0 \\Rightarrow t=1$, $x=1 \\Rightarrow t=2$.\n\n$$I = \\int_1^2 \\frac{1}{2t}\\,dt = \\frac{1}{2}\\ln|t|\\Big|_1^2 = \\frac{1}{2}\\ln 2$$",
      "images": [],
      "metadata": {
        "subject": "Toán học",
        "grade": "12",
        "topic": "Nguyên hàm - Tích phân",
        "subtopic": "Tích phân đổi biến",
        "difficulty": "Thông hiểu",
        "bloom_level": 2,
        "tags": ["tích phân", "đổi biến", "logarit"],
        "points": 0.25
      }
    },
    {
      "id": "Q003",
      "type": "multiple_choice",
      "content": "Cho số phức $z = 3 + 4i$. Tìm mô-đun của $z$.",
      "options": {
        "A": "$5$",
        "B": "$7$",
        "C": "$\\sqrt{7}$",
        "D": "$25$"
      },
      "correct_answer": "A",
      "solution": "$|z| = \\sqrt{3^2 + 4^2} = \\sqrt{9 + 16} = \\sqrt{25} = 5$",
      "images": [],
      "metadata": {
        "subject": "Toán học",
        "grade": "12",
        "topic": "Số phức",
        "subtopic": "Mô-đun số phức",
        "difficulty": "Nhận biết",
        "bloom_level": 1,
        "tags": ["số phức", "mô-đun"],
        "points": 0.25
      }
    },
    {
      "id": "Q004",
      "type": "essay",
      "content": "Cho hình chóp $S.ABCD$ có đáy $ABCD$ là hình vuông cạnh $a$, $SA \\perp (ABCD)$ và $SA = a\\sqrt{2}$.\n\na) Chứng minh $BD \\perp SC$.\n\nb) Tính khoảng cách từ $A$ đến mặt phẳng $(SBD)$.",
      "options": null,
      "correct_answer": null,
      "solution": "**a)** Ta có: $BD \\perp AC$ (tính chất đường chéo hình vuông)\n\n$SA \\perp (ABCD) \\Rightarrow SA \\perp BD$\n\nVậy $BD \\perp (SAC)$ (vì $BD$ vuông góc với 2 đường thẳng cắt nhau $SA$ và $AC$)\n\n$\\Rightarrow BD \\perp SC$ (vì $SC \\subset (SAC)$). ∎\n\n**b)** Gọi $O = AC \\cap BD$ (tâm hình vuông).\n\n$V_{S.ABD} = \\frac{1}{2} V_{S.ABCD} = \\frac{1}{2} \\cdot \\frac{1}{3} \\cdot a^2 \\cdot a\\sqrt{2} = \\frac{a^3\\sqrt{2}}{6}$\n\nTính $S_{\\triangle SBD}$: $SO = \\sqrt{SA^2 + AO^2} = \\sqrt{2a^2 + \\frac{a^2}{2}} = \\frac{a\\sqrt{10}}{2}$\n\n$BD = a\\sqrt{2}$\n\n$S_{\\triangle SBD} = \\frac{1}{2} \\cdot BD \\cdot SO = \\frac{a^2\\sqrt{5}}{2}$\n\n$$d(A, (SBD)) = \\frac{3V_{S.ABD}}{S_{\\triangle SBD}} = \\frac{3 \\cdot \\frac{a^3\\sqrt{2}}{6}}{\\frac{a^2\\sqrt{5}}{2}} = \\frac{a\\sqrt{10}}{5}$$",
      "images": ["images/page3_img1.png"],
      "metadata": {
        "subject": "Toán học",
        "grade": "12",
        "topic": "Hình học không gian",
        "subtopic": "Khoảng cách trong không gian",
        "difficulty": "Vận dụng",
        "bloom_level": 3,
        "tags": ["hình chóp", "khoảng cách", "chứng minh vuông góc"],
        "sub_questions": ["a", "b"],
        "points": 1.0
      }
    },
    {
      "id": "Q005",
      "type": "essay",
      "content": "Tính diện tích hình phẳng giới hạn bởi đồ thị hàm số $y = x^2 - 2x$ và trục $Ox$.",
      "options": null,
      "correct_answer": null,
      "solution": "Phương trình hoành độ giao điểm: $x^2 - 2x = 0 \\Leftrightarrow x(x-2) = 0$\n\n$\\Rightarrow x = 0$ hoặc $x = 2$\n\nTrên $[0, 2]$: $y = x^2 - 2x \\leq 0$.\n\n$$S = \\int_0^2 |x^2 - 2x|\\,dx = -\\int_0^2 (x^2 - 2x)\\,dx$$\n\n$$= -\\left[\\frac{x^3}{3} - x^2\\right]_0^2 = -\\left(\\frac{8}{3} - 4\\right) = \\frac{4}{3}$$",
      "images": [],
      "metadata": {
        "subject": "Toán học",
        "grade": "12",
        "topic": "Nguyên hàm - Tích phân",
        "subtopic": "Ứng dụng tích phân tính diện tích",
        "difficulty": "Vận dụng",
        "bloom_level": 3,
        "tags": ["tích phân", "diện tích", "hàm số bậc hai"],
        "points": 1.0
      }
    }
  ]
}
